{
  "cases": [
    {
      "case_id": "specs-status-countdown-and-late-night-policy",
      "expected": {
        "final_state": {
          "fixed_runs": [],
          "reminders": [],
          "rsvps": [],
          "runs": [],
          "side_effects": []
        },
        "steps": [
          {
            "value": [
              {
                "fire_at": "2026-08-31T09:00:00+08:00",
                "kind": "day_of"
              },
              {
                "fire_at": "2026-08-31T20:30:00+08:00",
                "kind": "countdown_60"
              },
              {
                "fire_at": "2026-08-31T21:00:00+08:00",
                "kind": "countdown_30"
              },
              {
                "fire_at": "2026-08-31T21:15:00+08:00",
                "kind": "countdown_15"
              }
            ]
          },
          {
            "value": [
              {
                "fire_at": "2026-08-31T09:00:00+08:00",
                "kind": "day_of"
              },
              {
                "fire_at": "2026-08-31T20:30:00+08:00",
                "kind": "countdown_60"
              }
            ]
          },
          {
            "value": [
              {
                "fire_at": "2026-08-31T09:00:00+08:00",
                "kind": "day_of"
              },
              {
                "fire_at": "2026-08-31T20:30:00+08:00",
                "kind": "countdown_60"
              }
            ]
          },
          {
            "value": [
              {
                "fire_at": "2026-08-31T09:00:00+08:00",
                "kind": "day_of"
              }
            ]
          },
          {
            "value": []
          },
          {
            "value": []
          },
          {
            "value": [
              {
                "fire_at": "2026-08-31T09:00:00+08:00",
                "kind": "day_of"
              }
            ]
          },
          {
            "value": [
              {
                "fire_at": "2026-08-31T09:00:00+08:00",
                "kind": "day_of"
              },
              {
                "fire_at": "2026-08-31T21:30:00+08:00",
                "kind": "countdown_0"
              }
            ]
          },
          {
            "value": [
              {
                "fire_at": "2026-08-31T09:00:00+08:00",
                "kind": "day_of"
              },
              {
                "fire_at": "2026-08-31T23:30:00+08:00",
                "kind": "countdown_60"
              }
            ]
          },
          {
            "value": [
              {
                "fire_at": "2026-08-30T09:00:00+08:00",
                "kind": "day_of"
              },
              {
                "fire_at": "2026-08-31T08:00:00+08:00",
                "kind": "countdown_60"
              }
            ]
          },
          {
            "value": [
              {
                "fire_at": "2026-08-31T09:00:00+08:00",
                "kind": "day_of"
              },
              {
                "fire_at": "2026-08-31T08:01:00+08:00",
                "kind": "countdown_60"
              }
            ]
          },
          {
            "value": [
              {
                "fire_at": "2026-08-31T01:00:00+08:00",
                "kind": "day_of"
              },
              {
                "fire_at": "2026-08-31T20:30:00+08:00",
                "kind": "countdown_60"
              }
            ]
          },
          {
            "value": [
              {
                "fire_at": "2026-08-31T09:00:00+08:00",
                "kind": "day_of"
              },
              {
                "fire_at": "2026-08-31T12:30:00+00:00",
                "kind": "countdown_60"
              }
            ]
          }
        ]
      },
      "input": {
        "clock": "2026-08-27T01:00:00+08:00",
        "steps": [
          {
            "at": "2026-08-31T21:30:00+08:00",
            "countdowns": [
              15,
              60,
              15,
              30
            ],
            "op": "reminder_specs",
            "ping_time": "09:00:00",
            "status": "planned"
          },
          {
            "at": "2026-08-31T21:30:00+08:00",
            "countdowns": [
              60
            ],
            "op": "reminder_specs",
            "ping_time": "09:00:00",
            "status": "confirmed"
          },
          {
            "at": "2026-08-31T21:30:00+08:00",
            "countdowns": [
              60
            ],
            "op": "reminder_specs",
            "ping_time": "09:00:00",
            "status": "at_risk"
          },
          {
            "at": "2026-08-31T21:30:00+08:00",
            "countdowns": [
              60,
              15
            ],
            "op": "reminder_specs",
            "ping_time": "09:00:00",
            "status": "otot"
          },
          {
            "at": "2026-08-31T21:30:00+08:00",
            "countdowns": [
              60
            ],
            "op": "reminder_specs",
            "ping_time": "09:00:00",
            "status": "cancelled"
          },
          {
            "at": "2026-08-31T21:30:00+08:00",
            "countdowns": [
              60
            ],
            "op": "reminder_specs",
            "ping_time": "09:00:00",
            "status": "done"
          },
          {
            "at": "2026-08-31T21:30:00+08:00",
            "countdowns": [],
            "op": "reminder_specs",
            "ping_time": "09:00:00",
            "status": "planned"
          },
          {
            "at": "2026-08-31T21:30:00+08:00",
            "countdowns": [
              0
            ],
            "op": "reminder_specs",
            "ping_time": "09:00:00",
            "status": "planned"
          },
          {
            "at": "2026-09-01T00:30:00+08:00",
            "countdowns": [
              60
            ],
            "op": "reminder_specs",
            "ping_time": "09:00:00",
            "status": "planned"
          },
          {
            "at": "2026-08-31T09:00:00+08:00",
            "countdowns": [
              60
            ],
            "op": "reminder_specs",
            "ping_time": "09:00:00",
            "status": "planned"
          },
          {
            "at": "2026-08-31T09:01:00+08:00",
            "countdowns": [
              60
            ],
            "op": "reminder_specs",
            "ping_time": "09:00:00",
            "status": "planned"
          },
          {
            "at": "2026-08-31T21:30:00+08:00",
            "countdowns": [
              60
            ],
            "op": "reminder_specs",
            "ping_time": "01:00:00",
            "status": "planned"
          },
          {
            "at": "2026-08-31T13:30:00+00:00",
            "countdowns": [
              60
            ],
            "op": "reminder_specs",
            "ping_time": "09:00:00",
            "status": "planned"
          }
        ],
        "timezone": "Asia/Kuala_Lumpur",
        "uuid_sequence": [
          "00000000-0000-4000-8001-000000000001",
          "00000000-0000-4000-8001-000000000002",
          "00000000-0000-4000-8001-000000000003",
          "00000000-0000-4000-8001-000000000004",
          "00000000-0000-4000-8001-000000000005",
          "00000000-0000-4000-8001-000000000006",
          "00000000-0000-4000-8001-000000000007",
          "00000000-0000-4000-8001-000000000008",
          "00000000-0000-4000-8001-000000000009",
          "00000000-0000-4000-8001-000000000010",
          "00000000-0000-4000-8001-000000000011",
          "00000000-0000-4000-8001-000000000012",
          "00000000-0000-4000-8001-000000000013",
          "00000000-0000-4000-8001-000000000014",
          "00000000-0000-4000-8001-000000000015",
          "00000000-0000-4000-8001-000000000016",
          "00000000-0000-4000-8001-000000000017",
          "00000000-0000-4000-8001-000000000018",
          "00000000-0000-4000-8001-000000000019",
          "00000000-0000-4000-8001-000000000020",
          "00000000-0000-4000-8001-000000000021",
          "00000000-0000-4000-8001-000000000022",
          "00000000-0000-4000-8001-000000000023",
          "00000000-0000-4000-8001-000000000024",
          "00000000-0000-4000-8001-000000000025",
          "00000000-0000-4000-8001-000000000026",
          "00000000-0000-4000-8001-000000000027",
          "00000000-0000-4000-8001-000000000028",
          "00000000-0000-4000-8001-000000000029",
          "00000000-0000-4000-8001-000000000030",
          "00000000-0000-4000-8001-000000000031",
          "00000000-0000-4000-8001-000000000032",
          "00000000-0000-4000-8001-000000000033",
          "00000000-0000-4000-8001-000000000034",
          "00000000-0000-4000-8001-000000000035",
          "00000000-0000-4000-8001-000000000036",
          "00000000-0000-4000-8001-000000000037",
          "00000000-0000-4000-8001-000000000038",
          "00000000-0000-4000-8001-000000000039",
          "00000000-0000-4000-8001-000000000040"
        ]
      }
    },
    {
      "case_id": "ensure-writes-past-slots-sent-and-prunes-unsent",
      "expected": {
        "final_state": {
          "fixed_runs": [],
          "reminders": [
            {
              "fire_at": "2026-08-31T01:00:00+00:00",
              "id": "00000000-0000-4000-8001-000000000002",
              "kind": "day_of",
              "message_id": null,
              "run_id": "00000000-0000-4000-8001-000000000001",
              "sent_at": "2026-08-31T13:00:00+00:00"
            },
            {
              "fire_at": "2026-08-31T12:30:00+00:00",
              "id": "00000000-0000-4000-8001-000000000003",
              "kind": "countdown_60",
              "message_id": null,
              "run_id": "00000000-0000-4000-8001-000000000001",
              "sent_at": "2026-08-31T13:00:00+00:00"
            },
            {